{"manifest_id":"kolosseum_final_registry_surface_authority","manifest_version":"1.0.0","slice_id":"REG-FULL-00","status":"authoritative","scope":"registry_architecture_only","base_commit":"c5be9c1810b9ce502af046610bebe1b5a77977f8","baseline":{"registry_index_order":["activity","movement","exercise","program","equipment","sport_subdivision","sport_metric","sport_role","metric_exercise_link","threshold_marker","exercise_token","exercise_activity_applicability"],"registry_bundle_blob_sha":"2ca1c43f3c56ce641193eccad5ac72a3e9e455f3","registry_surface_classification_blob_sha":"af8065348e3e529d8d24dffa2ee15b8d3fa4c994","registry_seal_state":"sealed","registry_seal_manifest_blob_sha":"b4bd736a8188ab9a5e1e68a40d4ee81ded7872c7","active_registry_file_set":["registries/activity/activity.registry.json","registries/movement/movement.registry.json","registries/exercise/exercise.registry.json","registries/program/program.registry.json","registries/equipment/equipment.registry.json","registries/sport_subdivision/sport_subdivision.registry.json","registries/sport_metric/sport_metric.registry.json","registries/sport_role/sport_role.registry.json","registries/metric_exercise_link/metric_exercise_link.registry.json","registries/threshold_marker/threshold_marker.registry.json","registries/exercise_token/exercise_token.registry.json","registries/exercise_activity_applicability/exercise_activity_applicability.registry.json"]},"supported_activity_scope":["powerlifting","general_strength","rugby_union","strongman","hyrox","crossfit","football_soccer","netball","basketball","rugby_sevens","field_hockey","ice_hockey","volleyball","cricket","american_football","athletics","swimming","olympic_weightlifting","cycling","rowing","kayaking","boxing","wrestling","judo","brazilian_jiu_jitsu","muay_thai","mma","tennis","triathlon","rugby_league","street_lifting","grip_sport"],"classification_enum":["required_active","derived_generated","retained_legacy","dormant","prohibited"],"authority_precedence":["current_law_and_explicit_supersession","frozen_registry_law","lawful_later_authorisation","current_contracts_guards","implementation_evidence","planning","developer_notes"],"final_load_order":["activity_registry_1","sport_subdivision_registry_1a","physical_requirements_registry_1b","sport_metric_registry_1c","event_metric_registry_1d","sport_role_registry_2","movement_registry_3","exercise_registry_3a","exercise_token_registry_3b","exercise_alias_registry_3c","exercise_variant_applicability_registry_3d","equipment_environment_registry_3e","biomechanics_registry_4","metric_exercise_link_registry_1c_a","training_structure_registry_5","structure_governance_registry_5a","sport_domain_structure_profiles_5b","explicit_override_accountability_registry_5c","sport_program_profile_registry_5d","sport_event_model_registry_5e","exercise_equipment_compatibility_registry","exercise_sport_applicability_registry_6x","sport_program_template_registry_5f","substitution_registry","copy_registry"],"entities":[{"entity_id":"activity_registry_1","canonical_registry_id":"activity_registry_1","canonical_name":"Activity","entity_kind":"registry","spine_slot":"1","classification":"required_active","current_state":{"repo_registry_ids":["activity","activity.registry","activity_registry_1"],"repo_paths":["registries/activity/activity.registry.json"],"registry_index_member":true,"registry_index_position":1,"surface_classification":"launch_critical","sealed_surface_member":true,"runtime_consumption":"runtime"},"final_state":{"authoritative":true,"final_runtime_load":true,"final_load_position":1,"new_content_allowed":true},"authority_sources":[{"source_id":"REGISTRY_LAW","source_type":"canonical","authority_status":"frozen","decision":"defines"}],"aliases_or_predecessors":["activity","activity.registry"],"successor_registry_id":null,"dependency_ids":[],"migration_action":"REG-FULL-01 schema/id","target_slice":"REG-FULL-01","rationale":"compact predecessor"},{"entity_id":"sport_subdivision_registry_1a","canonical_registry_id":"sport_subdivision_registry_1a","canonical_name":"Sport Subdivision","entity_kind":"registry","spine_slot":"1A","classification":"required_active","current_state":{"repo_registry_ids":["sport_subdivision","sport_subdivision.registry","sport_subdivision_registry_1a"],"repo_paths":["registries/sport_subdivision/sport_subdivision.registry.json"],"registry_index_member":true,"registry_index_position":6,"surface_classification":"launch_critical","sealed_surface_member":true,"runtime_consumption":"non_runtime"},"final_state":{"authoritative":true,"final_runtime_load":true,"final_load_position":2,"new_content_allowed":true},"authority_sources":[{"source_id":"REGISTRY_LAW","source_type":"canonical","authority_status":"frozen","decision":"defines"}],"aliases_or_predecessors":["sport_subdivision"],"successor_registry_id":null,"dependency_ids":["activity_registry_1"],"migration_action":"REG-FULL-01 schema/id","target_slice":"REG-FULL-01","rationale":"1A activation maps here"},{"entity_id":"physical_requirements_registry_1b","canonical_registry_id":"physical_requirements_registry_1b","canonical_name":"Physical Requirements","entity_kind":"registry","spine_slot":"1B","classification":"required_active","current_state":{"repo_registry_ids":[],"repo_paths":[],"registry_index_member":false,"registry_index_position":null,"surface_classification":null,"sealed_surface_member":false,"runtime_consumption":"none"},"final_state":{"authoritative":true,"final_runtime_load":true,"final_load_position":3,"new_content_allowed":true},"authority_sources":[{"source_id":"REGISTRY_LAW","source_type":"canonical","authority_status":"frozen","decision":"defines"}],"aliases_or_predecessors":[],"successor_registry_id":null,"dependency_ids":["activity_registry_1","sport_subdivision_registry_1a"],"migration_action":"REG-FULL-01 schema","target_slice":"REG-FULL-01","rationale":"canonical missing live file"},{"entity_id":"sport_metric_registry_1c","canonical_registry_id":"sport_metric_registry_1c","canonical_name":"Sport Metric","entity_kind":"registry","spine_slot":"1C","classification":"required_active","current_state":{"repo_registry_ids":["sport_metric","sport_metric.registry","sport_metric_registry_1c"],"repo_paths":["registries/sport_metric/sport_metric.registry.json"],"registry_index_member":true,"registry_index_position":7,"surface_classification":"launch_critical","sealed_surface_member":true,"runtime_consumption":"non_runtime"},"final_state":{"authoritative":true,"final_runtime_load":true,"final_load_position":4,"new_content_allowed":true},"authority_sources":[{"source_id":"DEV_SPINE","source_type":"canonical","authority_status":"extension","decision":"adds"}],"aliases_or_predecessors":["sport_metric"],"successor_registry_id":null,"dependency_ids":["activity_registry_1","sport_subdivision_registry_1a"],"migration_action":"REG-FULL-01 schema/id","target_slice":"REG-FULL-01","rationale":"1C activation maps here"},{"entity_id":"event_metric_registry_1d","canonical_registry_id":"event_metric_registry_1d","canonical_name":"Event Metric","entity_kind":"registry","spine_slot":"1D","classification":"required_active","current_state":{"repo_registry_ids":[],"repo_paths":[],"registry_index_member":false,"registry_index_position":null,"surface_classification":null,"sealed_surface_member":false,"runtime_consumption":"none"},"final_state":{"authoritative":true,"final_runtime_load":true,"final_load_position":5,"new_content_allowed":true},"authority_sources":[{"source_id":"DEV_SPINE","source_type":"canonical","authority_status":"extension","decision":"adds"}],"aliases_or_predecessors":[],"successor_registry_id":null,"dependency_ids":["sport_metric_registry_1c"],"migration_action":"REG-FULL-01 schema","target_slice":"REG-FULL-01","rationale":"DEV SPINE authority"},{"entity_id":"sport_role_registry_2","canonical_registry_id":"sport_role_registry_2","canonical_name":"Sport Role","entity_kind":"registry","spine_slot":"2","classification":"required_active","current_state":{"repo_registry_ids":["sport_role","sport_role.registry","sport_role_registry_2"],"repo_paths":["registries/sport_role/sport_role.registry.json"],"registry_index_member":true,"registry_index_position":8,"surface_classification":"launch_critical","sealed_surface_member":true,"runtime_consumption":"non_runtime"},"final_state":{"authoritative":true,"final_runtime_load":true,"final_load_position":6,"new_content_allowed":true},"authority_sources":[{"source_id":"REGISTRY_LAW","source_type":"canonical","authority_status":"frozen","decision":"defines"}],"aliases_or_predecessors":["sport_role"],"successor_registry_id":null,"dependency_ids":["sport_subdivision_registry_1a"],"migration_action":"REG-FULL-01 schema/id","target_slice":"REG-FULL-01","rationale":"Registry 2 activation maps here"},{"entity_id":"movement_registry_3","canonical_registry_id":"movement_registry_3","canonical_name":"Movement","entity_kind":"registry","spine_slot":"3","classification":"required_active","current_state":{"repo_registry_ids":["movement","movement.registry","movement_registry_3"],"repo_paths":["registries/movement/movement.registry.json"],"registry_index_member":true,"registry_index_position":2,"surface_classification":"launch_critical","sealed_surface_member":true,"runtime_consumption":"runtime"},"final_state":{"authoritative":true,"final_runtime_load":true,"final_load_position":7,"new_content_allowed":true},"authority_sources":[{"source_id":"REGISTRY_LAW","source_type":"canonical","authority_status":"frozen","decision":"defines"}],"aliases_or_predecessors":["movement","movement.registry"],"successor_registry_id":null,"dependency_ids":["activity_registry_1"],"migration_action":"REG-FULL-01 schema/id","target_slice":"REG-FULL-01","rationale":"compact predecessor"},{"entity_id":"exercise_registry_3a","canonical_registry_id":"exercise_registry_3a","canonical_name":"Exercise","entity_kind":"registry","spine_slot":"3A","classification":"required_active","current_state":{"repo_